{
  "slug": "chocolate-chunk-cookies",
  "title": "Chocolate Chunk Cookies",
  "tags": ["dessert", "vegetarian"],
  "servings": 24,
  "prepMinutes": 15,
  "cookMinutes": 12,
  "description": "Chewy brown-butter cookies with big pools of chocolate.",
  "components": [
    {
      "name": null,
      "ingredients": [
        { "id": "butter", "quantity": 1, "unit": "cup", "prep": "browned and cooled" },
        { "id": "brown-sugar", "quantity": 1, "unit": "cup" },
        { "id": "granulated-sugar", "quantity": 0.5, "unit": "cup" },
        { "id": "egg", "quantity": 2, "unit": "whole", "prep": "room temperature" },
        { "id": "vanilla-extract", "quantity": 2, "unit": "tsp" },
        { "id": "all-purpose-flour", "quantity": 2.25, "unit": "cup" },
        { "id": "baking-soda", "quantity": 1, "unit": "tsp" },
        { "id": "salt", "quantity": 1, "unit": "tsp" },
        { "id": "chocolate-chunk", "quantity": 85, "unit": "g" }
      ]
    }
  ],
  "steps": [
    "Whisk the browned butter with both sugars until glossy, then beat in the eggs and vanilla.",
    "Stir in the flour, baking soda and salt until just combined, then fold in the chocolate.",
    "Chill the dough for 30 minutes. Heat the oven to 350°F.",
    "Scoop 2-tablespoon balls onto a lined sheet and bake 10 to 12 minutes, until the edges are set."
  ],
  "notes": ["Dough keeps 3 days in the fridge and improves with rest."]
}
